{
  "name": "Example Title",
  "td": 10,
  "servicetype": "example_value",
  "ipv46": "example_value",
  "port": 10,
  "ipset": "example_value",
  "range": 10,
  "ippattern": "example_value",
  "ipmask": "example_value",
  "stateupdate": "example_value",
  "precedence": "example_value",
  "casesensitive": "example_value",
  "somethod": "example_value",
  "sopersistence": "example_value",
  "sopersistencetimeout": 10,
  "sothreshold": 10,
  "redirecturl": "https://www.example.com",
  "clttimeout": 10,
  "downstateflush": "example_value",
  "insertvserveripport": "example_value",
  "vipheader": "example_value",
  "disableprimaryondown": "example_value",
  "authentication": "example_value",
  "authenticationhost": "example_value",
  "authn401": "example_value",
  "authnvsname": "example_value",
  "push": "example_value",
  "pushlabel": "example_value",
  "pushmulticlients": "example_value",
  "comment": "example_value",
  "l2conn": "example_value",
  "icmpvsrresponse": "example_value",
  "rhistate": "example_value",
  "appflowlog": "example_value",
  "state": "example_value",
  "lbvserver": "example_value",
  "targetlbvserver": "example_value",
  "cachetype": "example_value",
  "redirect": "example_value",
  "curstate": "example_value",
  "status": 10,
  "statechangetimesec": "example_value",
  "tickssincelaststatechange": 10,
  "type": "example_value",
  "ngname": "example_value",
  "value": "example_value"
}